{"type":"mechanic","version":1,"id":"situated-evidence-fragment","name":"Situated evidence fragment","status":"OBSERVED","summary":"A narrative fragment gains meaning from its author, time, location, condition, audience, and relationship to nearby evidence instead of functioning as detached exposition.","player_action":"The player discovers a page, recording, object, message, performance, or resident account and interprets why it exists there.","system_response":"The game binds the fragment to a specific source and world context while preserving what remains unknown or disputed.","encouraged_behavior":["close observation","source comparison","revisitation","inference"],"experience_targets":["curiosity","intimacy","unease","discovery"],"requirements":["stable fragment identity","source metadata","placement context","evidence state","retrievable journal"],"relationships":{"strengthens":["environmental-causal-trace","conflict-preserving-narrative-ledger"],"weakened_by":["random placement without contextual rules","omniscient wording","duplicate exposition"],"conflicts_with":["fragment claiming events its source could not know"]},"failure_modes":["The fragment says the same thing wherever it appears.","The author knows facts unavailable to them.","Collecting the fragment silently converts inference into truth.","The journal strips away the placement that made the fragment meaningful."],"production":{"implementation_cost":"MEDIUM","content_cost":"HIGH","tuning_cost":"MEDIUM","required_disciplines":["narrative design","level design","audio","art","interface"]},"accessibility":["Provide transcripts, replay, scalable text, speaker identity, and non-audio discovery cues.","Preserve placement and source context in the journal."],"smallest_playable_test":{"setup":"One room with four fragments from two sources, one altered object, one deliberate conflict, and a journal that records source and location.","measure":["fragments discovered","source attribution","sequence of interpretation","claims marked fact or inference","context recalled"],"retain_if":"Players reconstruct the bounded event and identify the unresolved conflict without receiving an omniscient summary.","revise_if":"Fragments are understood individually but placement or authorship adds no information.","reject_if":"A fragment contradicts its available knowledge or the journal asserts a single unsupported account."},"evidence":[{"kind":"OFFICIAL","source":"https://www.mobiusdigitalgames.com/outer-wilds.html","claim":"Mobius describes using a translator to decipher ancient writing and environmental tools to investigate mysteries across changing locations.","observed":"2026-08-11","game_version":"Outer Wilds official developer page","notes":"Supports fragments whose meaning depends on source, location, and comparison across a world."}],"supersedes":null,"notes":[],"updated":"2026-08-11"}
