{"type":"mechanic","version":1,"id":"decision-transforming-difficulty","name":"Decision-transforming difficulty","status":"OBSERVED","summary":"Difficulty adds value when it changes which risks, roles, routes, counters, resources, or timing decisions matter—not merely how long enemies take to kill.","player_action":"The player selects or enters a challenge rule, understands what changed, and revises strategy or execution.","system_response":"The game applies bounded modifiers to encounter composition, enemy behavior, resources, information, persistence, or objectives and reports the active rule set.","encouraged_behavior":["deliberate challenge selection","strategy revision","skill diagnosis","replay"],"experience_targets":["mastery","tension","ownership","fair challenge"],"requirements":["declared modifier identity","baseline comparison","counterplay preservation","separate tuning axes","reproducible rule set"],"relationships":{"strengthens":["enemy-role-differentiation","rare-variant-rule-mutation","boss-phase-teach-and-recombine"],"weakened_by":["opaque scaling","multiple modifiers that collapse to one damage check"],"conflicts_with":["difficulty defined only as enemy health and outgoing damage multipliers"]},"failure_modes":["A modifier lengthens fights without changing decisions.","Challenge rules interact into unavoidable or unreadable states.","The UI names difficulty but not the changed rules.","Average completion hides a deterministic impossible composition."],"production":{"implementation_cost":"HIGH","content_cost":"MEDIUM","tuning_cost":"HIGH","required_disciplines":["systems design","combat design","telemetry","interface","quality assurance"]},"accessibility":["Separate challenge modifiers from accessibility settings.","Describe each changed rule and permit bounded customization where progression allows."],"smallest_playable_test":{"setup":"One encounter tested with health scaling, damage scaling, role remix, behavioral mutation, resource constraint, and persistence rule individually and in bounded pairs.","measure":["decision changes","completion time","failure attribution","dominant strategy","unavoidable states","selected preference"],"retain_if":"The modifier produces a reproducible new decision while remaining readable and counterable.","revise_if":"The decision changes but explanation, interaction, or tuning obscures why.","reject_if":"The modifier only increases duration, punishment, or repetition without requiring a different choice or skill."},"evidence":[{"kind":"OFFICIAL","source":"https://www.supergiantgames.com/blog/hades-the-nighty-night-update-patch-notes/","claim":"Supergiant documents separate Pact modifiers that disable player talents or grant varied enemy behavioral perks rather than expressing all challenge through one scalar.","observed":"2026-08-11","game_version":"Hades Nighty Night Update","notes":"Supports separable challenge axes; balance and preference remain empirical."},{"kind":"OFFICIAL","source":"https://slayersclub.bethesda.net/en-NZ/article/doom-eternal-master-levels","claim":"Bethesda describes Master Levels as remixed challenges for players who mastered the fundamentals while retaining a separate preferred difficulty setting.","observed":"2026-08-11","game_version":"DOOM Eternal Master Levels","notes":"Supports composition remix being distinct from base difficulty."}],"supersedes":null,"notes":[],"updated":"2026-08-11"}
