{"type":"mechanic","version":1,"id":"deterministic-diagnostic-replay","name":"Deterministic diagnostic replay","status":"PROVISIONAL","summary":"A production failure becomes actionable when its build, content, platform, seed, configuration, inputs, authoritative events, and stop point can be replayed or its first divergence identified.","player_action":"A tester or player encounters a crash, hitch, state disagreement, inaccessible cue, or progression defect.","system_response":"The diagnostic path captures a bounded reproduction packet and compares replayed checkpoints until it reproduces the failure or names the earliest unsupported difference.","encouraged_behavior":["evidence-backed debugging","small reproducible reports","cross-discipline correction"],"experience_targets":["stability","fast correction","trustworthy releases"],"requirements":["stable event identities","build and content hashes","seed capture","configuration manifest","privacy-bounded telemetry","checkpoint comparison"],"relationships":{"strengthens":["release-evidence-gate","frame-time-budget-and-graceful-degradation","versioned-save-migration"],"weakened_by":["unversioned content","hidden runtime randomness","mutable diagnostics"],"conflicts_with":["claims of reproduction without matching environment"]},"failure_modes":["The replay uses a different build or configuration without disclosing it.","Input logs omit asynchronous state that controlled the failure.","The packet captures private data unrelated to reproduction.","A non-reproduced report is silently treated as disproven."],"production":{"implementation_cost":"HIGH","content_cost":"LOW","tuning_cost":"MEDIUM","required_disciplines":["engine programming","tools","online","privacy","quality assurance"]},"accessibility":["Capture active accessibility configuration because it can alter input and presentation paths.","Allow local export and readable consent before transmitting diagnostic evidence."],"smallest_playable_test":{"setup":"Inject one deterministic crash, one frame hitch, one save disagreement, and one dropped accessibility cue into an instrumented arena, then reproduce each from a bounded packet on a second machine.","measure":["packet completeness","first divergent checkpoint","reproduction rate","packet size","private fields collected","time to diagnosis"],"retain_if":"Each injected failure reproduces or stops at a named external dependency without collecting unrelated data.","revise_if":"The packet locates divergence but remains too large or platform-specific for routine use.","reject_if":"A matching packet reports success while replayed authoritative state differs or diagnostics leak undeclared data."},"evidence":[],"supersedes":null,"notes":["Provisional until a repository-owned executable replay reproduces injected failures across at least two environments."],"updated":"2026-08-11"}
