{"type":"mechanic","version":1,"id":"exploration-state-journal","name":"Exploration-state journal","status":"PROVISIONAL","summary":"A journal or map preserves what the player has actually discovered, what remains unresolved, and where knowledge came from without converting uncertainty into instructions.","player_action":"The player inspects recorded places, clues, discoveries, and unresolved observations before choosing where to investigate next.","system_response":"The system records only witnessed exploration state, binds it to stable place and discovery identities, and distinguishes unknown, noticed, resolved, missed, and inaccessible states.","encouraged_behavior":["reflection","self-directed goals","long-term exploration","return planning"],"experience_targets":["memory","completion","mystery","agency"],"requirements":["stable place registry","discovery-state model","evidence trigger","persistent save state"],"relationships":{"strengthens":["knowledge-gated-revisitation","collection-ledger-completion","spatial-landmark-legibility"],"weakened_by":["automatic spoilers","unstable room identities"],"conflicts_with":["objective text that invents knowledge the player never acquired"]},"failure_modes":["The journal reveals a secret before its clue is observed.","A procedural room moves while its recorded identity does not.","Resolved discoveries remain indistinguishable from unresolved clues.","Completion totals imply that all categories were available in the current run."],"production":{"implementation_cost":"HIGH","content_cost":"MEDIUM","tuning_cost":"MEDIUM","required_disciplines":["save programming","interface","level design","narrative design","quality assurance"]},"accessibility":["Offer searchable text, icons, location context, and user-added markers.","Separate optional hints from the evidence record and disclose when assistance adds information."],"smallest_playable_test":{"setup":"Six rooms, four evidence events, two secrets, one unavailable route, one world-state change, save/reload, and a fresh profile comparison.","measure":["record provenance","spoiler leakage","state accuracy","return-plan formation","reload stability","procedural identity mismatch"],"retain_if":"Every entry can be regenerated from witnessed events and helps players form a return plan without disclosing an unseen solution.","revise_if":"State remains accurate but categories or unknown states confuse players.","reject_if":"The journal fabricates knowledge, loses discovery lineage, or cannot bind records after layout regeneration."},"evidence":[],"supersedes":null,"notes":["Provisional until reproduced in a playable slice; Majora's Mask-inspired journal satisfaction is a design target, not yet causal evidence."],"updated":"2026-08-11"}
