{
  "type":"mechanic","version":1,"id":"collection-ledger-completion","name":"Collection-ledger completion","status":"OBSERVED","summary":"A durable collection ledger converts rare acquisition into visible long-term progress without claiming that recorded completion improves the acquisition odds.","player_action":"The player discovers an eligible item and later inspects category and total completion.","system_response":"The system records the stable item identity once, updates category totals, and preserves provenance across sessions.","encouraged_behavior":["exploration","mastery","long-term collection","content discovery"],"experience_targets":["completion","memory","anticipation","recognition"],"requirements":["stable item registry","eligibility rules","persistent discovery state","category totals"],"relationships":{"strengthens":["reward-pool-progression","pickup-state-confirmation"],"weakened_by":["retroactive omission","unstable identifiers"],"conflicts_with":["displayed slots that do not correspond to obtainable records"]},"failure_modes":["Owned eligible items are missing from the ledger.","Counts change without a content or correction event.","Duplicate acquisition creates duplicate completion.","The ledger implies increased odds that do not exist."],"production":{"implementation_cost":"MEDIUM","content_cost":"HIGH","tuning_cost":"LOW","required_disciplines":["save programming","content design","interface","quality assurance"]},"accessibility":["Expose category and total progress with text as well as icons.","Mark unknown, unobtainable, and retired states distinctly."],"smallest_playable_test":{"setup":"Ten eligible items across two categories, duplicates, retroactive ownership, one retired item, and save migration.","measure":["ledger-to-inventory agreement","duplicate counting","migration loss","completion comprehension"],"retain_if":"Every eligible discovery records once and totals remain reproducible after reload and migration.","revise_if":"State is correct but unknown or retired slots mislead players.","reject_if":"Completion totals cannot be regenerated from the item registry and discovery state."},"evidence":[{"kind":"COMMUNITY_DOCUMENTATION","source":"https://oldschool.runescape.wiki/w/Update%3ABounty_Hunter_Changes%2C_Collection_Log_Updates_%26_Emote_Improvements","claim":"An archived official Old School RuneScape update records collection-log slot-count discrepancies and a hotfix restoring expected totals.","observed":"2026-08-11","game_version":"Old School RuneScape update of 2025-01-29","notes":"Supports total consistency as a player-visible contract; it does not establish drop causality."}],"supersedes":null,"notes":[],"updated":"2026-08-11"
}
