{"type":"mechanic","version":1,"id":"focused-retry-boundary","name":"Focused retry boundary","status":"OBSERVED","summary":"A retry teaches efficiently when it returns the player near the newest unresolved decision while preserving enough consequence for earlier execution to matter.","player_action":"The player fails, restarts, and practices the unresolved section.","system_response":"The checkpoint boundary restores a declared state with bounded setup time, resources, and solved prerequisites.","encouraged_behavior":["focused practice","experimentation","cause comparison","mastery"],"experience_targets":["momentum","fairness","tension","competence"],"requirements":["checkpoint state","dependency graph","deterministic restoration","retry timing metrics"],"relationships":{"strengthens":["knowledge-bearing-repetition"],"weakened_by":["long solved preambles","variable restoration","loading delay"],"conflicts_with":["zero-cost retry that bypasses the tested resource decision"]},"failure_modes":["Solved traversal dominates time before the unsolved rule.","The restored resource state changes the intended decision.","The checkpoint skips a dependency needed to understand failure.","Instant retries remove every meaningful consequence."],"production":{"implementation_cost":"MEDIUM","content_cost":"MEDIUM","tuning_cost":"HIGH","required_disciplines":["game design","level design","save engineering","analytics"]},"accessibility":["Offer practice and reduced-repetition options separately from difficulty.","Do not require repeated unskippable presentation before control returns."],"smallest_playable_test":{"setup":"A three-stage encounter where stages one and two can become solved while stage three remains unsolved; compare start, midpoint, and immediate retry boundaries.","measure":["time back to unresolved decision","state fidelity","attempts per learning change","tension rating","abandonment"],"retain_if":"The boundary minimizes non-learning repetition without changing the unresolved decision or eliminating consequence.","revise_if":"Learning accelerates but tension or resource meaning collapses.","reject_if":"Most retry time repeats already-solved content or restored state invalidates comparison."},"evidence":[{"kind":"OFFICIAL","source":"https://en.bandainamcoent.eu/dark-souls/dark-souls-remastered","claim":"Bandai Namco presents Dark Souls Remastered as a world of challenge, discovery, and repeated mastery supported by bonfire-based progression.","observed":"2026-08-11","game_version":"Dark Souls Remastered official product page","notes":"Supports studying retry position as part of challenge and world traversal."}],"supersedes":null,"notes":[],"updated":"2026-08-11"}
