{"type":"mechanic","version":1,"id":"adaptive-music-state","name":"Adaptive music state","status":"OBSERVED","summary":"Adaptive music supports emotion and anticipation when musical layers and transitions respond to bounded gameplay state without replacing actionable cues or restarting visibly at every minor event.","player_action":"The player explores, enters danger, escalates combat, discovers something, succeeds, fails, or returns to calm.","system_response":"The score transitions or layers according to declared state, intensity, location, narrative context, and cooldown rules while maintaining musical continuity.","encouraged_behavior":["anticipation","exploration","combat commitment","emotional reflection"],"experience_targets":["tension","wonder","momentum","memory"],"requirements":["music state model","transition graph","layer stems or adaptive segments","mix priority","cooldown and hysteresis"],"relationships":{"strengthens":["encounter-pressure-release","knowledge-gated-revisitation"],"weakened_by":["rapid state oscillation","mix competition with critical dialogue or cues"],"conflicts_with":["music that guarantees safety or reveals an unseen threat as authoritative fact"]},"failure_modes":["Music thrashes between states during boundary movement.","A combat layer arrives after the decision window.","Silence or calm reliably proves no threat exists.","Music masks dialogue, navigation, or enemy intent."],"production":{"implementation_cost":"HIGH","content_cost":"HIGH","tuning_cost":"HIGH","required_disciplines":["composition","music implementation","audio programming","level design","narrative"]},"accessibility":["Separate music volume from effects, dialogue, and accessibility cues.","Do not require musical pitch or rhythm recognition for critical action."],"smallest_playable_test":{"setup":"One exploration loop with calm, uncertainty, detection, combat, discovery, victory, and recovery states plus rapid boundary and false-threat cases.","measure":["transition latency","state thrashing","cue masking","emotional interpretation","false safety inference"],"retain_if":"Music tracks meaningful state changes smoothly and strengthens anticipation without becoming required tactical information.","revise_if":"Emotional shape works but transitions, mix, or repetition expose the system.","reject_if":"Music contradicts state, masks required cues, or makes silence a guaranteed safety signal."},"evidence":[{"kind":"TECHNICAL_ANALYSIS","source":"https://www.gdcvault.com/play/1026983/Scoring-the-Open-World-Samurai","claim":"Sony's Ghost of Tsushima music team documents an adaptive system supporting exploration and an interactive open-world score.","observed":"2026-08-11","game_version":"Ghost of Tsushima GDC 2021 presentation","notes":"Primary developer presentation overview; specific implementation requires the session."}],"supersedes":null,"notes":[],"updated":"2026-08-11"}
