{"type":"mechanic","version":1,"id":"optional-discovery-mechanical-reward","name":"Optional discovery mechanical reward","status":"PROVISIONAL","summary":"Missable lore can grant a bounded mechanical advantage when the reward follows from what was learned, remains inspectable, and is never required to recover a mandatory weapon or viable baseline path.","player_action":"The player discovers and interprets optional evidence, then applies the learned counter, modification, recipe, route, or efficiency.","system_response":"The game binds the discovery to a declared optional reward while preserving mandatory equipment and baseline solvability outside the secret path.","encouraged_behavior":["searching","journal completion","experimentation","preparedness"],"experience_targets":["rewarded curiosity","ownership","discovery","mastery"],"requirements":["discovery identity","causal reward mapping","mandatory-content manifest","baseline solvability proof","missed-content accounting"],"relationships":{"strengthens":["situated-evidence-fragment","knowledge-gated-revisitation"],"weakened_by":["arbitrary stat bonuses","permanent unknowable lockout","reward duplication"],"conflicts_with":["missable discovery containing the only mandatory weapon or counter"]},"failure_modes":["Lore is reduced to a collectible tax.","The bonus has no relationship to the learned information.","Missing one page makes the main path nonviable.","A guide is required to know that a permanent lockout occurred."],"production":{"implementation_cost":"HIGH","content_cost":"HIGH","tuning_cost":"HIGH","required_disciplines":["narrative design","combat design","economy","interface","quality assurance"]},"accessibility":["Make discovery cues and journal state available through multiple channels.","Provide late bounded recovery for permanently missable functional rewards."],"smallest_playable_test":{"setup":"One enemy family, one mandatory base weapon, three optional evidence pages, one assembled counter-mod, one cosmetic completion reward, and a no-pages control route.","measure":["discovery rate","causal understanding","baseline completion","reward use","guide dependence","missed-state awareness"],"retain_if":"Pages deepen understanding and grant a useful related option while every no-pages run remains viable and complete in mandatory equipment.","revise_if":"The reward works but overwhelms the meaning of the evidence or trivializes the enemy.","reject_if":"A missable page gates mandatory survival, the reward is arbitrary, or completion requires external lookup."},"evidence":[],"supersedes":null,"notes":["Directly test hidden weapon-mod pages without making any base gun permanently missable."],"updated":"2026-08-11"}
