{"type":"mechanic","version":1,"id":"world-integrated-interface","name":"World-integrated interface","status":"OBSERVED","summary":"A world-integrated interface preserves presence when status and interaction surfaces inhabit the fiction while still meeting readability, input, interruption, and accessibility requirements.","player_action":"The player checks status, inventory, equipment, objectives, or an environmental control without fully leaving the represented space.","system_response":"The interface projects or embeds current authoritative state, preserves spatial context, and exposes equivalent readable alternatives where embodiment reduces usability.","encouraged_behavior":["situational awareness","deliberate preparation","environmental attention","continuous play"],"experience_targets":["presence","cohesion","vulnerability","clarity"],"requirements":["authoritative state binding","world-space rendering","focus and input rules","occlusion control","accessible fallback"],"relationships":{"strengthens":["event-bound-feedback-orchestration","spatial-landmark-legibility"],"weakened_by":["camera collision","busy backgrounds","uncontrolled combat interruption"],"conflicts_with":["diegetic styling that makes essential text or state unreadable"]},"failure_modes":["World lighting or motion makes information unreadable.","The interface displays stale inventory or status.","Opening a surface silently pauses or fails to pause threats.","Style prevents scaling, narration, contrast, or alternative layout."],"production":{"implementation_cost":"HIGH","content_cost":"MEDIUM","tuning_cost":"HIGH","required_disciplines":["UI design","gameplay programming","rendering","animation","accessibility"]},"accessibility":["Provide scalable, high-contrast, narrated, and screen-fixed alternatives.","State clearly whether gameplay continues while the interface is open."],"smallest_playable_test":{"setup":"Health, inventory, weapon selection, objective, and environmental switch interfaces tested in calm, movement, combat, darkness, occlusion, and accessible fallback modes.","measure":["state accuracy","read time","input errors","threat awareness","occlusion","fallback equivalence"],"retain_if":"The interface preserves context and exposes current state without sacrificing supported readability or control.","revise_if":"Embodiment works in calm scenes but fails under motion, lighting, or interruption.","reject_if":"A conventional accessible alternative is required to understand state but is absent or semantically different."},"evidence":[{"kind":"OFFICIAL","source":"https://www.ea.com/news/breaking-into-the-industry-dino-ignacio-ui-lead-at-visceral-games","claim":"Dead Space UI lead Dino Ignacio describes holographic weapon, inventory, switch, screen, menu, and title interfaces built as gateways into the game world.","observed":"2026-08-11","game_version":"Dead Space franchise UI developer interview","notes":"Supports world-integrated interface scope; accessibility requirements are bounded extensions to test."}],"supersedes":null,"notes":[],"updated":"2026-08-11"}
