{"type":"mechanic","version":1,"id":"enemy-role-differentiation","name":"Enemy-role differentiation","status":"OBSERVED","summary":"An enemy earns a roster slot when its readable behavior creates a distinct priority, positioning demand, resource decision, or interruption pattern.","player_action":"The player identifies an enemy role, predicts its pressure, and changes target, position, timing, weapon, or resource use.","system_response":"Silhouette, movement, sound, attack timing, range, vulnerability, and group behavior consistently expose the enemy's decision pressure.","encouraged_behavior":["threat assessment","target prioritization","movement adaptation","tool selection"],"experience_targets":["mastery","readability","variety","controlled panic"],"requirements":["distinct behavioral role","recognizable intent","counterplay window","roster comparison"],"relationships":{"strengthens":["enemy-intent-telegraphing","combat-resource-recovery"],"weakened_by":["shared silhouettes and sounds","role overlap without changed decisions"],"conflicts_with":["enemy variety expressed only through health and damage"]},"failure_modes":["Two enemy types produce the same optimal response.","The dangerous role is identifiable only after unavoidable damage.","Visual size or rarity implies a role the behavior does not perform.","One universal weapon and position dominate every role."],"production":{"implementation_cost":"HIGH","content_cost":"HIGH","tuning_cost":"HIGH","required_disciplines":["combat design","AI programming","animation","audio","character art"]},"accessibility":["Repeat role identity across silhouette, motion, sound, iconography, and attack rhythm.","Provide adjustable telegraph contrast without changing authoritative timing."],"smallest_playable_test":{"setup":"Four enemies with one role each: pursuer, area denial, support, and ranged punish; test alone, in pairs, and in mixed groups.","measure":["role identification","target-order changes","position changes","damage source comprehension","dominant strategy rate"],"retain_if":"Players can explain each role and mixed compositions change priority or movement without relying on labels.","revise_if":"Roles are distinct in isolation but collapse into visual noise in groups.","reject_if":"Removing an enemy type changes only total health, damage, or completion time."},"evidence":[{"kind":"OFFICIAL","source":"https://slayersclub.bethesda.net/en-US/article/designing-demons-noclip","claim":"Bethesda presents id Software's enemy process around knowing distinct adversaries and learning how to defeat them.","observed":"2026-08-11","game_version":"DOOM Eternal pre-release developer feature","notes":"Supports enemy-specific counterknowledge; detailed role causality still requires playable comparison."}],"supersedes":null,"notes":[],"updated":"2026-08-11"}
