{"type":"mechanic","version":1,"id":"boss-phase-teach-and-recombine","name":"Boss-phase teach and recombine","status":"OBSERVED","summary":"A boss becomes learnable when early states isolate readable rules and later states recombine, accelerate, invert, or spatially constrain those rules without abandoning their feedback language.","player_action":"The player observes a pattern, survives or exploits it, retains the lesson, and applies it under a changed combination or arena constraint.","system_response":"Each phase introduces or transforms a bounded rule, signals the transition, and preserves causal feedback for success and failure.","encouraged_behavior":["pattern learning","anticipation","adaptation","execution under pressure"],"experience_targets":["fear","mastery","escalation","climactic resolution"],"requirements":["phase state machine","telegraph continuity","counterplay","transition feedback","checkpoint policy"],"relationships":{"strengthens":["enemy-intent-telegraphing","combat-hit-confirmation","encounter-pressure-release"],"weakened_by":["phase transitions without readable cause","long repetition before the newest lesson"],"conflicts_with":["boss phases that discard all learned rules for unrelated spectacle"]},"failure_modes":["A phase introduces lethal behavior before any readable learning opportunity.","The same phase repeats after mastery only through larger health.","Transition presentation hides the boss's actionable state.","Failure requires replaying solved content longer than practicing the failed rule."],"production":{"implementation_cost":"HIGH","content_cost":"HIGH","tuning_cost":"HIGH","required_disciplines":["combat design","AI programming","animation","audio","level design","quality assurance"]},"accessibility":["Maintain redundant anticipation cues across phases.","Offer practice, checkpoint, or assist options that preserve rule identity."],"smallest_playable_test":{"setup":"A three-phase boss: isolated attack lesson, two-rule combination, then spatial recombination; expose health and timing multipliers separately.","measure":["attack comprehension","failure attribution","attempts per lesson","solved-phase repetition","phase-transition errors"],"retain_if":"Players can state what each phase taught and later failures trace to execution or a visible recombination.","revise_if":"Rules are learnable but repetition or transition cost prevents focused practice.","reject_if":"Victory depends on absorbing damage, unexplained immunity, or memorizing untelegraphed phase exceptions."},"evidence":[{"kind":"OFFICIAL","source":"https://slayersclub.bethesda.net/pt-BR/article/doom-eternal-boss-tips","claim":"Bethesda's DOOM Eternal boss guidance documents persistent opening cues and a later Gladiator phase that adds dual weapons, shockwave spacing, and a counterattack window.","observed":"2026-08-11","game_version":"DOOM Eternal","notes":"Supports phase transformation and retained cue language; guidance is more explicit than blind play."}],"supersedes":null,"notes":[],"updated":"2026-08-11"}
