{"type":"mechanic","version":1,"id":"accessibility-equivalence-verification","name":"Accessibility equivalence verification","status":"OBSERVED","summary":"An accessibility option is verified by comparing the objective, actionable meaning, timing, state, and reward path it preserves—not by counting settings or requiring identical presentation.","player_action":"The player configures input, text, audio, visual, motion, cognition, or assistance options and performs the same bounded objective.","system_response":"The game substitutes channels and interaction forms while declaring any intentional change to information, timing, challenge, scoring, or rewards.","encouraged_behavior":["self-configuration","independent play","informed assistance choices"],"experience_targets":["access","clarity","agency","fairness"],"requirements":["remappable controls","semantic event identities","channel alternatives","configuration persistence","disabled-player testing","declared assistance effects"],"relationships":{"strengthens":["accessibility-channel-substitution-preserves-meaning","world-integrated-interface","release-evidence-gate"],"weakened_by":["single-channel critical cues","settings that do not compose","late accessibility review"],"conflicts_with":["undisclosed reward or state changes"]},"failure_modes":["A substitute cue arrives after the response window.","A remapped action remains hard-coded elsewhere.","Text or narration describes stale state.","An assist secretly changes progression, scoring, or encounter identity.","Individually valid options fail when combined."],"production":{"implementation_cost":"HIGH","content_cost":"MEDIUM","tuning_cost":"HIGH","required_disciplines":["accessibility","design","interface","audio","engineering","localization","quality assurance"]},"accessibility":["Test with players who use the supported configurations rather than treating guidelines as proof.","Preserve player-owned settings across retry, save migration, platform change, and update."],"smallest_playable_test":{"setup":"Run one navigation, combat, puzzle, pickup, journal, death, and save objective under representative remap, hold/toggle, text, contrast, narration, cue-substitution, motion, flash, and assistance combinations.","measure":["objective completion","actionable cue timing","errors","fatigue","state and reward identity","configuration persistence","undisclosed information"],"retain_if":"Each supported configuration preserves the declared objective and clearly discloses any intentional difference in information, challenge, state, or reward.","revise_if":"Completion is possible but timing, effort, comfort, or configuration discovery creates avoidable barriers.","reject_if":"A required objective depends on one sensory or motor channel, settings conflict, or hidden state/reward differences occur."},"evidence":[{"kind":"OFFICIAL","source":"https://learn.microsoft.com/en-us/gaming/accessibility/guidelines","claim":"Xbox Accessibility Guidelines provide implementation and testing guidance developed with the gaming and disability community for design, development, and test teams.","observed":"2026-08-11","game_version":"Xbox Accessibility Guidelines","notes":"Guidelines inform tests but do not replace verification with players."},{"kind":"OFFICIAL","source":"https://www.ea.com/en-gb/news/accessibility-and-player-choice-in-dead-space","claim":"EA documents Dead Space menu narration, contrast and color options, remapping, hold/toggle alternatives, aim-assistance controls, and optional content warnings or visual hiding.","observed":"2026-08-11","game_version":"Dead Space remake","notes":"Shows independent configuration across multiple access needs."}],"supersedes":null,"notes":[],"updated":"2026-08-11"}
