{"type":"mechanic","version":1,"id":"run-variation-with-rule-continuity","name":"Run variation with rule continuity","status":"OBSERVED","summary":"Replayable runs stay learnable when layouts, offers, and encounters vary while identities, causal rules, and declared mutation boundaries remain stable.","player_action":"The player recognizes known rule families in a new run and adapts their route or build.","system_response":"The generator changes combinations and positions from a reproducible seed without silently redefining component behavior.","encouraged_behavior":["adaptation","route planning","build experimentation","pattern learning"],"experience_targets":["surprise","mastery","replayability","trust"],"requirements":["seeded generation","stable component identities","compatibility constraints","solvability validation","run receipt"],"relationships":{"strengthens":["knowledge-bearing-repetition"],"weakened_by":["unbounded random mutation","unrecorded seeds","identity reuse"],"conflicts_with":["novelty created by hidden rule replacement"]},"failure_modes":["A known object behaves differently without a declared mutation.","One seed removes every viable response.","Variation changes cosmetics but not decisions.","The generator cannot reproduce a reported failure."],"production":{"implementation_cost":"HIGH","content_cost":"HIGH","tuning_cost":"HIGH","required_disciplines":["systems programming","content design","quality assurance","analytics"]},"accessibility":["Keep critical identity cues stable across variants.","Expose seed replay and reduce-flash options without changing generated rules."],"smallest_playable_test":{"setup":"Twelve authored components, four rule families, compatibility constraints, fifty generated runs, exact seed replay, and one intentionally invalid combination.","measure":["decision diversity","identity recognition","solvability","failure reproduction","dominant routes"],"retain_if":"Runs demand different choices while players transfer correct knowledge and every failure reproduces from its receipt.","revise_if":"Variation is valid but produces excessive noise or weak strategic difference.","reject_if":"Any accepted seed is unsolvable, irreproducible, or changes an undeclared component rule."},"evidence":[{"kind":"OFFICIAL","source":"https://www.playstation.com/en-us/games/returnal/","claim":"PlayStation describes Returnal's world as changing whenever the player dies, requiring repeated adaptation.","observed":"2026-08-11","game_version":"Returnal official product description","notes":"Supports varied runs whose repeated structure remains central to learning."}],"supersedes":null,"notes":[],"updated":"2026-08-11"}
