{
  "type":"mechanic","version":1,"id":"reward-pool-progression","name":"Reward-pool progression","status":"OBSERVED","summary":"A reward pool changes as items are discovered so repeated completion can guarantee breadth before returning to unrestricted chance.","player_action":"The player repeatedly completes an activity seeking distinct rewards.","system_response":"Undiscovered rewards receive bounded priority until the declared set is unlocked, after which normal drop rules resume.","encouraged_behavior":["activity mastery","collection completion","repeat participation"],"experience_targets":["anticipation","progress","fairness","variety"],"requirements":["stable reward identities","discovery ledger","declared pool","post-completion rule"],"relationships":{"strengthens":["pickup-state-confirmation"],"weakened_by":["hidden pool changes","duplicate identity drift"],"conflicts_with":["unbounded duplicate chance before baseline completion"]},"failure_modes":["The pool cannot state what completion means.","Knockout state diverges from owned rewards.","Later pool changes silently invalidate completion.","Guaranteed breadth removes every long-term chase."],"production":{"implementation_cost":"MEDIUM","content_cost":"HIGH","tuning_cost":"HIGH","required_disciplines":["economy design","backend or save programming","interface","analytics"]},"accessibility":["Expose discovered and remaining categories without requiring external tools.","Distinguish guaranteed progression from random chance."],"smallest_playable_test":{"setup":"A six-item pool with duplicates, three simulated profiles, save/reload, and a post-completion phase.","measure":["completions to breadth","duplicate sequence","ledger agreement","continued motivation"],"retain_if":"Every profile reaches declared breadth without state disagreement and post-completion rewards remain meaningful.","revise_if":"Breadth succeeds but anticipation collapses or the final item feels mechanically predetermined too early.","reject_if":"Players can complete the activity repeatedly without measurable pool progress under the declared guarantee."},"evidence":[{"kind":"OFFICIAL","source":"https://origin-static01.bungie.net/7/en/News/Article/twid_07_03_2025","claim":"Bungie documented Nightfall rewards using a knockout list until all weapons are unlocked, then returning to flat drop chances.","observed":"2026-08-11","game_version":"Destiny 2 Edge of Fate reward changes","notes":"Supports a two-phase breadth-then-chance structure."}],"supersedes":null,"notes":[],"updated":"2026-08-11"
}
