{
  "type":"mechanic","version":1,"id":"pickup-state-confirmation","name":"Pickup state confirmation","status":"OBSERVED","summary":"A reward remains trustworthy when eligibility, spawn, availability, collection, inventory transfer, and persistence are distinct observable states.","player_action":"The player earns, approaches, and collects a reward.","system_response":"The system exposes the reward state and confirms exactly when ownership or inventory changes.","encouraged_behavior":["resource awareness","route adjustment","collection confidence"],"experience_targets":["clarity","satisfaction","trust"],"requirements":["authoritative reward state","inventory capacity rules","pickup feedback","persistence boundary"],"relationships":{"strengthens":["combat-resource-recovery"],"weakened_by":["silent transfer","ambiguous eligibility"],"conflicts_with":["presentation before authority"]},"failure_modes":["A visible reward cannot be collected without explanation.","Feedback plays before inventory changes.","Automatic transfer hides capacity or destination.","A collected reward reappears after reload."],"production":{"implementation_cost":"MEDIUM","content_cost":"MEDIUM","tuning_cost":"MEDIUM","required_disciplines":["gameplay programming","interface","sound design","quality assurance"]},"accessibility":["Confirm collection through configurable redundant channels.","Do not identify reward class only by color."],"smallest_playable_test":{"setup":"Three reward types, limited inventory, automatic and manual pickup, one interrupted transfer, and a save/reload.","measure":["state identification","false collection belief","lost reward count","transfer destination recognition"],"retain_if":"Players can identify every reward state and collected items persist exactly once.","revise_if":"Transfer succeeds but destination or capacity is unclear.","reject_if":"Presentation and authoritative ownership repeatedly disagree."},"evidence":[{"kind":"OFFICIAL","source":"https://help.bungie.net/hc/en-us/articles/8048011793812-Twitch-Drops","claim":"Bungie's help flow distinguishes qualification, claim, automatic deposit, collection destination, and recovery checks when delivery fails.","observed":"2026-08-11","game_version":"Destiny 2 reward delivery guidance","notes":"External reward delivery exposes the same state-boundary problem at a larger timescale."}],"supersedes":null,"notes":[],"updated":"2026-08-11"
}
