{"type":"mechanic","version":1,"id":"versioned-save-migration","name":"Versioned save migration","status":"OBSERVED","summary":"Persistent progress survives software change when save schemas declare versions, migrate through explicit steps, validate before commit, and fail without overwriting the last readable state.","player_action":"The player launches a newer build, changes platform, resumes offline, or resolves a synchronized-save conflict.","system_response":"The game identifies the save lineage, migrates a copy through known versions, validates earned state, and atomically promotes or visibly rejects the result.","encouraged_behavior":["safe return","cross-version continuity","confident updates"],"experience_targets":["continuity","ownership","reliability","cross-platform play"],"requirements":["schema versions","migration functions","atomic commit","backup or rollback","conflict policy","newer-version rejection"],"relationships":{"strengthens":["death-state-partition","deterministic-diagnostic-replay","release-evidence-gate"],"weakened_by":["implicit field defaults","in-place destructive migration","platform identity ambiguity"],"conflicts_with":["silent progress merge"]},"failure_modes":["Migration loses, duplicates, or reclassifies earned state.","A newer unknown save is accepted as an older schema.","Cloud conflict selection is hidden from the player.","A crash leaves neither original nor migrated state readable."],"production":{"implementation_cost":"HIGH","content_cost":"LOW","tuning_cost":"MEDIUM","required_disciplines":["save engineering","online","platform","quality assurance","interface"]},"accessibility":["Conflict and failure prompts must be readable through supported text, narration, and input configurations.","Accessibility settings require the same explicit version and migration policy as progression state."],"smallest_playable_test":{"setup":"Create saves at every supported version and profile state, then inject interruption at each migration boundary plus newer, corrupt, duplicated, offline, and cloud-conflict cases.","measure":["earned-state identity before and after","migration path","commit atomicity","rollback availability","conflict disclosure","settings preservation"],"retain_if":"Every supported source reaches one validated successor without loss or duplication and every unsupported source leaves its parent intact.","revise_if":"State is preserved but the conflict or recovery path is unclear to players.","reject_if":"Any interruption or version produces silent acceptance, partial migration, overwrite, loss, or duplication."},"evidence":[{"kind":"OFFICIAL","source":"https://dev.epicgames.com/documentation/en-us/unreal-engine/versioning-of-assets-and-packages-in-unreal-engine","claim":"Epic documents GUID-based custom versions so independently evolving systems can identify serialized data versions.","observed":"2026-08-11","game_version":"Unreal Engine documentation","notes":"Supports explicit version identity; atomic migration and rollback remain release requirements here."},{"kind":"OFFICIAL","source":"https://help.bungie.net/hc/articles/360049498031","claim":"Bungie documents one active Destiny 2 character set across linked platforms, dormant non-selected characters, platform-license boundaries, authentication, and deactivation consequences.","observed":"2026-08-11","game_version":"Destiny 2 Cross Save Guide","notes":"Demonstrates why account, character, entitlement, and platform identities cannot be silently merged."}],"supersedes":null,"notes":[],"updated":"2026-08-11"}
