{
  "type": "mechanic", "version": 1, "id": "combat-hit-confirmation", "name": "Combat hit confirmation", "status": "OBSERVED",
  "summary": "A successful attack is described by coordinated target, weapon, sound, camera, environment, and interface responses whose magnitude matches the event.",
  "player_action": "The player attacks and observes whether, where, and how strongly the attack connected.",
  "system_response": "The authoritative damage event emits bounded feedback that distinguishes miss, armor, health damage, stagger, critical impact, and kill.",
  "encouraged_behavior": ["aim correction", "target prioritization", "weapon mastery"],
  "experience_targets": ["clarity", "impact", "satisfaction", "trust"],
  "requirements": ["authoritative hit event", "material and target state", "feedback routing", "intensity controls"],
  "relationships": {"strengthens": ["movement-feedback-stack"], "weakened_by": ["latency", "visual clutter", "uniform response"], "conflicts_with": ["effects that obscure the next threat"]},
  "failure_modes": ["Feedback reports damage that did not occur.", "Different outcomes look or sound identical.", "Repeated hits create unreadable accumulation.", "Reduced effects remove all confirmation."],
  "production": {"implementation_cost": "MEDIUM", "content_cost": "HIGH", "tuning_cost": "HIGH", "required_disciplines": ["gameplay programming", "animation", "visual effects", "sound design", "accessibility"]},
  "accessibility": ["Permit independent reduction of shake, flash, sound, numbers, and haptics.", "Keep at least two configurable confirmation channels."],
  "smallest_playable_test": {"setup": "One weapon, one target with armor and health, one weak point, one wall, and toggles for each feedback channel.", "measure": ["outcome identification", "false-positive confirmation", "event-to-feedback latency", "next-target visibility"], "retain_if": "Players identify miss, armor, damage, critical, and kill without contradictory cues.", "revise_if": "Identification depends on one optional channel or effects hide the next decision.", "reject_if": "Players repeatedly believe misses hit or harmless impacts dealt damage."},
  "evidence": [{"kind": "OFFICIAL", "source": "https://www.supergiantgames.com/blog/hades-the-nighty-night-update-patch-notes/", "claim": "Hades revised directional, rapid-fire, armored, kill, and player-damage effects together to improve combat clarity.", "observed": "2026-08-11", "game_version": "Hades Nighty Night update", "notes": "Patch records establish differentiated hit-feedback classes, not universal timing values."}],
  "supersedes": null, "notes": [], "updated": "2026-08-11"
}
