{"type":"mechanic","version":1,"id":"knowledge-gated-revisitation","name":"Knowledge-gated revisitation","status":"OBSERVED","summary":"Returning becomes meaningful when a learned rule, acquired capability, changed state, or remembered clue creates a new decision in an already understood place.","player_action":"The player remembers an unresolved feature and returns after gaining knowledge, access, equipment, or a world-state change.","system_response":"The familiar location preserves its identity while exposing a new route, interpretation, shortcut, resource, threat, or narrative fragment.","encouraged_behavior":["memory","recontextualization","planned backtracking","world mastery"],"experience_targets":["coherence","progression","discovery","ownership of knowledge"],"requirements":["persistent unresolved cues","return path","changed capability or knowledge","new consequential state"],"relationships":{"strengthens":["spatial-landmark-legibility","learnable-secret-language","exploration-state-journal"],"weakened_by":["long empty retraversal","unmarked irreversible lockouts"],"conflicts_with":["backtracking that reproduces the same decisions and rewards"]},"failure_modes":["The return trip contains no changed decision.","A new tool opens only color-coded locks and never changes spatial understanding.","The original clue disappears before it can be resolved.","Fast travel or reset state makes the remembered route incoherent."],"production":{"implementation_cost":"HIGH","content_cost":"HIGH","tuning_cost":"HIGH","required_disciplines":["systems design","level design","save programming","environment art","narrative design"]},"accessibility":["Record unresolved discoveries without prescribing their solution.","Offer traversal shortcuts after the player has demonstrated route understanding."],"smallest_playable_test":{"setup":"A compact loop contains one visible inaccessible route, one clue that becomes interpretable later, and one shortcut opened from the far side.","measure":["unprompted return","reason for return","retraversal time","new decision count","shortcut comprehension","reward relevance"],"retain_if":"Players return for a remembered reason and the resolved route changes later navigation or understanding.","revise_if":"The resolution is meaningful but retraversal cost overwhelms anticipation.","reject_if":"Return is compelled solely by a waypoint and repeats the original route without a new choice."},"evidence":[{"kind":"OFFICIAL","source":"https://www.ea.com/en-gb/news/inside-dead-space-1-remaking-a-classic","claim":"Motive describes an interconnected Ishimura that permits revisiting completed locations for missed items, new navigation paths, and new challenges.","observed":"2026-08-11","game_version":"Dead Space remake developer feature","notes":"Supports interconnected revisitation; it does not establish that all backtracking is valuable."}],"supersedes":null,"notes":[],"updated":"2026-08-11"}
